{
  "schemaVersion": "1.0",
  "sceneId": "workshop",
  "revision": 8,
  "backgroundAssetId": "workshop-day",
  "actors": [],
  "items": [],
  "overlays": [],
  "dialogue": [
    {
      "id": "line-8",
      "speakerId": null,
      "text": "Вы закрасили два участка. Синяя краска закончилась."
    }
  ],
  "music": null
}
